Players,Team,Specialism,Sold,Batting_Style,Bowling_Style,Test_Caps,ODI_Caps,T20_Caps,IPL_Matches,Player_Status,Reason_for_Retention
Andre Russell,KKR,ALL-ROUNDER,12,LHB,RIGHT ARM Medium,6,13,16,107,Capped,"Andre Russell is Caribbean all-rounder with 6 Test caps, 13 ODI appearances, 16 T20I matches, representing complete player capable of winning matches single-handedly. His explosive batting combined with death-overs bowling makes him one of world's most destructive T20 players valued across global franchises. In IPL, his 107 matches with KKR showcase consistent impact performances as both batsman and bowler, with ability to change match outcomes in crunch situations. At age 36, despite approaching veteran status, his athleticism and explosive power remain relatively undiminished compared to age peers in world cricket. His role at KKR as explosive middle-order all-rounder provides tactical flexibility while his experience influences team culture positively. KKR's retention reflects confidence in Russell's continued contributions as match-winner capable of delivering in tournament's critical moments."
Harshit Rana,KKR,BOWLER,4,RHB,RIGHT ARM Fast,2,0,1,9,Uncapped,"Harshit Rana is an uncapped young Indian fast bowler with 2 Test caps, 0 ODI appearances, 1 T20I cap, representing India's emerging pace bowling talent. At just age 22, his exceptional pace (145+ km/h) and ability to extract bounce from Indian pitches positions him as rare young talent with world-class potential. In IPL, despite limited exposure (9 matches), his performances showcase ability to trouble quality batsmen despite inexperience in franchise cricket's high-pressure environment. His retention by KKR is investment in developing young Indian fast bowler to provide long-term bowling stability while he develops through experience. His uncapped status in IPL context provides KKR significant salary cap advantage while securing services of potential future India pace spearhead. KKR's retention reflects franchise philosophy of identifying young talent early and providing platform for development within structured environment."
Ramandeep Singh,KKR,ALL-ROUNDER,4,RHB,RIGHT ARM Leg Spin,0,0,0,21,Uncapped,"Ramandeep Singh is an uncapped young Indian all-rounder with 0 international caps, representing emerging domestic talent identified by KKR for franchise development. At just age 21, he combines right-hand batting with occasional off-break bowling, providing modern T20 team's requirement of all-round skill flexibility. In IPL, despite limited exposure (21 matches), his potential demonstrated through domestic cricket performances in domestic T20 leagues. His retention by KKR reflects investment in young Indian all-rounder capable of development into core squad member over next 5-6 years. His uncapped status provides KKR exceptional salary cap advantage while securing early rights to emerging talent before valuations increase. KKR's retention strategy emphasizes identifying young talent early and providing franchise platform for development through consistent exposure."
Sanju Samson,RR,BATTER,18,RHB,,1,2,0,35,Capped,"Sanju Samson is an Indian wicketkeeper-batsman with 1 Test cap, 2 ODI appearances, 0 T20I caps, demonstrating tremendous international potential despite limited caps. At age 30, his aggressive batting style and exceptional fitness combined with pure batting ability positions him as capable of playing at highest international level. In IPL, he has played 35 matches establishing reputation as entertaining batsman capable of playing explosive innings in crucial situations. His retention as RR captain reflects franchise confidence in his leadership qualities combined with batting prowess to lead team in tournament. His role extends beyond captaincy—his presence influences team culture and represents RR's philosophy of building around Indian talent. RR's retention reflects strategic positioning of Samson as franchise leader capable of delivering performances in pressure situations."
Yashasvi Jaiswal,RR,ALL-ROUNDER,18,RHB,RIGHT ARM Leg Spin,1,2,13,62,Capped,"Yashasvi Jaiswal is emerging Indian talent with 1 Test cap, 2 ODI appearances, 13 T20I matches, representing India's next generation opening batsman for international cricket. At just age 22, his aggressive left-hand batting combined with solid technique against quality bowling positions him as potential future India opener. In IPL, he has played 62 matches establishing consistent performances as reliable opening batsman with ability to anchor innings or accelerate in powerplay. His retention by RR reflects franchise confidence in his development as core opening batsman capable of leading RR's batting lineup for next 7-8 years. At his age and career trajectory, his potential to develop into India's Test and T20 opening batsman makes him invaluable long-term investment. RR's early retention is strategic move to secure emerging talent before valuations increase post future international performances."
Riyan Parag,RR,ALL-ROUNDER,14,RHB,RIGHT ARM Leg Spin,0,2,14,98,Capped,"Riyan Parag is Indian all-rounder with 0 Test caps, 2 ODI appearances, 14 T20I matches, representing emerging talent in modern T20 cricket's all-rounder category. At age 22, his right-hand batting combined with off-break bowling provides tactical flexibility while his aggressive batting style suits modern T20 requirements. In IPL, he has played 98 matches establishing consistent performances with growing reputation for playing crucial innings in pressure situations. His retention by RR reflects franchise confidence in his development as core all-rounder capable of contributing across formats over next 6-7 years. At his age and given his trajectory, his potential to develop into India's premium all-rounder makes him invaluable for franchise building. RR's strategic retention represents investment in young talent with significant upside potential for both franchise and Indian cricket."
Dhruv Jurel,RR,BATTER,14,RHB,,5,1,2,41,Capped,"Dhruv Jurel is Indian wicketkeeper-batsman with 5 Test caps, 1 ODI appearance, 2 T20I matches, representing India's next-generation wicketkeeper capable of multiple formats. At just age 21, his technical prowess combined with aggressive batting approach positions him as potential long-term solution for India's wicketkeeper role. In IPL, he has played 41 matches establishing reputation as reliable wicketkeeper-batsman capable of batting in middle-order or opening position as situation demands. His retention by RR reflects strategic investment in young Indian wicketkeeper to provide succession planning while he develops through franchise exposure. At his age and given his multi-format exposure, his potential to develop into India's premier wicketkeeper-batsman makes him invaluable long-term prospect. RR's retention ensures continuity behind stumps while providing Jurel with consistent platform for continued development."
Shimron Hetmyer,RR,BATTER,11,RHB,,5,2,12,63,Capped,"Shimron Hetmyer is Caribbean batter with 5 Test caps, 2 ODI appearances, 12 T20I matches, representing West Indian batting talent specializing in T20 cricket formats. At age 27, his explosive batting style combined with technical soundness against quality bowling makes him valuable overseas investment for T20 teams. In IPL, he has played 63 matches establishing reputation as reliable left-hand batsman capable of playing aggressive innings in crunch situations. His retention by RR reflects franchise confidence in his continued contributions as overseas batting option capable of delivering in pressure matches. Despite West Indian cricket's recent decline, Hetmyer's individual performances and fitness levels remain high, ensuring continued value for franchise investing in him. RR's retention positions Hetmyer as core overseas batsman for middle-order balance."
Sandeep Sharma,RR,BOWLER,4,RHB,RIGHT ARM Fast Medium,0,0,0,26,Uncapped,"Sandeep Sharma is an uncapped Indian fast bowler with 0 international caps, representing emerging domestic talent identified by RR for franchise development and mentorship. At age 29, his extensive first-class cricket experience combined with reliable right-arm fast bowling establishes him as seasoned domestic performer. In IPL, despite limited exposure (26 matches), his consistent bowling performances demonstrate ability to contribute meaningfully at franchise level. His retention by RR reflects franchise philosophy of investing in reliable domestic performers capable of providing backup bowling option while developing for higher opportunities. His uncapped status indicates readiness to progress to international cricket given proper opportunity and consistent performance at franchise level. RR's retention ensures bowling depth while providing Sandeep with continued platform for development within structured team environment."
Rashid Khan,GT,BOWLER,18,RHB,RIGHT ARM Leg Spin,0,0,34,88,Capped,"Rashid Khan is Afghan cricket phenomenon with 0 Test caps, 0 ODI appearances, 34 T20I caps, representing one of world's best T20 spinners at just age 25. His mystery leg-break bowling combined with ability to execute in pressure situations has made him most valuable player across global T20 leagues. In IPL, his 88 matches with GT showcase world-class performances with economy rates and strike rates that define elite-level T20 bowling standards. His captaincy role with GT reflects franchise confidence in his leadership qualities beyond bowling prowess, positioning him as franchise cornerstone. At just 25 years old with already 34 T20I caps, his potential to develop into all-time great spinner positions him as invaluable long-term investment. GT's retention of Rashid at premium price reflects strategic decision to build franchise around young captain with world-class bowling credentials."
Shubman Gill,GT,BATTER,16.5,RHB,,1,11,8,63,Capped,"Shubman Gill is Indian opening batsman with 1 Test cap, 11 ODI appearances, 8 T20I matches, representing India's next-generation Test opening batsman. At just age 24, his technical prowess combined with aggressive batting approach positions him as potential future India opener for Test cricket. In IPL, he has played 63 matches establishing reputation as reliable opening batsman capable of anchoring innings or accelerating in powerplay according to match requirements. His retention by GT reflects franchise confidence in his development as cornerstone opening batsman for next 7-8 years of franchise cricket. His international exposure combined with domestic success indicates readiness to develop into India's senior opening batsman in coming years. GT's retention ensures continuity in opening position while providing Gill with consistent platform for continued international development."
Sai Sudharsan,GT,ALL-ROUNDER,8.5,RHB,LEFT ARM Slow Orthodox,0,3,4,18,Capped,"Sai Sudharsan is Indian all-rounder with 0 Test caps, 3 ODI appearances, 4 T20I matches, representing emerging young talent in modern cricket's all-rounder category. At just age 24, his left-hand batting combined with orthodox left-arm spin bowling provides modern T20 team's requirement for batting-bowling balance. In IPL, he has played 18 matches with promising performances demonstrating ability to contribute both batting and bowling in franchise environment. His retention by GT reflects investment in developing young Indian all-rounder capable of providing batting and bowling flexibility over next 6-7 years. At his age and with multi-format international exposure, his potential to develop into premium all-rounder makes him valuable for franchise building. GT's retention represents strategic investment in young talent with significant upside potential for both franchise and Indian cricket future."
Rahul Tewatia,GT,ALL-ROUNDER,4,RHB,,0,1,3,27,Capped,"Rahul Tewatia is Indian all-rounder with 0 Test caps, 1 ODI appearance, 3 T20I matches, representing domestic talent specializing in T20 cricket's all-rounder requirements. At age 27, his left-hand batting combined with right-arm medium bowling provides tactical flexibility in T20 combinations while his aggressive batting suits modern formats. In IPL, he has played 27 matches with growing reputation for finishing lower-order innings through aggressive batting in final overs. His retention by GT reflects franchise value of experienced all-rounder capable of contributing across situations while providing bowling variation options. His domestic cricket success combined with international exposure indicates capability to perform at highest levels when opportunities arise. GT's retention ensures all-round balance in squad while providing Tewatia consistent platform for continued development."
M Shahrukh Khan,GT,ALL-ROUNDER,4,RHB,RIGHT ARM Medium,0,0,0,13,Uncapped,"M Shahrukh Khan is uncapped young Indian all-rounder with 0 international caps, representing emerging domestic talent identified by GT for franchise development. At just age 23, his right-hand batting combined with occasional right-arm medium bowling establishes him as modern all-rounder capable of T20 requirements. In IPL, despite limited exposure (13 matches), his potential demonstrated through domestic T20 performances and limited franchise opportunities. His retention by GT reflects investment in developing young Indian all-rounder capable of providing batting and bowling flexibility over next 6-7 years. His uncapped status provides GT significant salary cap advantage while securing early rights to emerging talent. GT's retention strategy emphasizes identifying young talent early and providing franchise platform for development through consistent exposure."
Nicholas Pooran,LSG,BATTER,21,RHB,,2,17,16,28,Capped,"Nicholas Pooran is Caribbean wicketkeeper-batsman with 2 Test caps, 17 ODI appearances, 16 T20I matches, representing West Indian batting talent and explosive T20 specialist. At age 28, his aggressive left-hand batting combined with athletic wicketkeeping skills makes him valuable overseas investment for LSG. In IPL, he has played 28 matches establishing reputation as entertaining batsman capable of playing explosive innings in crucial situations. His retention by LSG reflects franchise confidence in his continued contributions as overseas wicketkeeper-batsman capable of providing batting explosiveness. Despite West Indian cricket's recent difficulties, Pooran's individual performances remain consistently high, ensuring continued value for franchise investing in him. LSG's retention positions Pooran as core overseas middle-order option."
Ravi Bishnoi,LSG,BOWLER,11,RHB,RIGHT ARM Leg Spin,0,4,19,44,Capped,"Ravi Bishnoi is Indian legspinner with 0 Test caps, 4 ODI appearances, 19 T20I matches, representing India's next-generation premier spinner in T20 cricket. At just age 23, his leg-break bowling combined with young age positions him as potential future world-class spinner for Indian cricket. In IPL, he has played 44 matches establishing consistent performances with economy rates and strike rates demonstrating world-class bowling potential. His retention by LSG reflects franchise confidence in his development as core spinner capable of leading LSG's bowling unit for next 7-8 years. At his age with already 19 T20I caps, his trajectory suggests readiness to develop into India's leading spinner in coming years. LSG's retention ensures bowling stability while providing Bishnoi with consistent platform for international development."
Mayank Yadav,LSG,BOWLER,11,RHB,RIGHT ARM Fast Medium,2,1,1,27,Uncapped,"Mayank Yadav is uncapped young Indian fast bowler with 2 Test caps, 1 ODI appearance, 1 T20I match, representing exceptional Indian pace bowling talent. At just age 21, his exceptional pace (150+ km/h) and ability to bowl consistent yorkers establishes him as rare young talent with world-class potential. In IPL, despite limited exposure (27 matches), his performances showcase ability to trouble quality batsmen with short-pitched and yorker deliveries. His retention by LSG is investment in developing young Indian fast bowler to provide long-term pace bowling foundation while he develops through experience. At his age with limited caps but international exposure, his potential makes him invaluable for LSG's future bowling plans. LSG's retention reflects franchise philosophy of investing in emerging young pace bowling talent with exceptional skill ceiling."
Mohsin Khan,LSG,BOWLER,4,RHB,RIGHT ARM Fast Medium,0,0,0,5,Uncapped,"Mohsin Khan is uncapped young Indian fast bowler with 0 international caps, representing emerging domestic talent identified by LSG for franchise development. At just age 21, his right-arm fast bowling combined with domestic first-class experience establishes him as promising young pacer. In IPL, despite minimal exposure (5 matches), his potential demonstrated through domestic cricket performances and limited franchise opportunities. His retention by LSG reflects investment in developing young Indian fast bowler to provide long-term pace bowling options. His uncapped status provides LSG significant salary cap advantage while securing early rights to young emerging talent. LSG's retention ensures bowling depth development while providing Mohsin with continued platform for consistent exposure."
Ayush Badoni,LSG,ALL-ROUNDER,4,RHB,RIGHT ARM Leg Spin,0,0,0,20,Uncapped,"Ayush Badoni is uncapped young Indian all-rounder with 0 international caps, representing emerging domestic talent identified by LSG for franchise development. At just age 22, his right-hand batting combined with occasional right-arm leg-spin bowling provides tactical flexibility required in modern T20 cricket. In IPL, despite limited exposure (20 matches), his potential demonstrated through domestic performances and growing reputation among cricket analysts. His retention by LSG reflects investment in developing young Indian all-rounder capable of providing batting and bowling flexibility. His uncapped status provides LSG exceptional salary cap advantage while securing early rights to emerging talent before valuations increase. LSG's retention strategy emphasizes identifying young talent early and providing franchise platform for development."
Shashank Singh,PBKS,ALL-ROUNDER,5.5,RHB,,0,0,0,36,Uncapped,"Shashank Singh is uncapped young Indian batter with 0 international caps, representing emerging domestic talent identified by PBKS for franchise development. At just age 23, his right-hand batting combined with domestic first-class experience establishes him as promising young batsman. In IPL, despite limited exposure (36 matches), his performances demonstrate ability to contribute meaningfully in middle-order position. His retention by PBKS reflects investment in developing young Indian batter capable of providing batting depth over next 6-7 years. His uncapped status provides PBKS significant salary cap advantage while securing early rights to young emerging talent. PBKS' retention ensures batting depth development while providing Shashank with continued platform for consistent exposure."
Prabhsimran Singh,PBKS,BATTER,4,RHB,,0,0,0,19,Uncapped,"Prabhsimran Singh is uncapped young Indian wicketkeeper-batsman with 0 international caps, representing emerging domestic talent identified by PBKS for franchise development. At just age 22, his right-hand batting combined with wicketkeeping skills establishes him as promising young keeper-batter. In IPL, despite limited exposure (19 matches), his potential demonstrated through domestic performances and growing reputation as future India wicketkeeper prospect. His retention by PBKS reflects investment in developing young Indian wicketkeeper-batsman capable of providing succession planning. His uncapped status provides PBKS exceptional salary cap advantage while securing early rights to young emerging talent. PBKS' retention ensures long-term wicketkeeper position while providing Prabhsimran with platform for continued development."
