Players,Team,Specialism,Sold,Batting_Style,Bowling_Style,Test_Caps,ODI_Caps,T20_Caps,IPL_Matches,Player_Status,Reason_for_Retention
Virat Kohli,RCB,BATTER,21,RHB,,123,308,125,267,Capped,"Virat Kohli is the greatest run-scorer in IPL history with 261 matches and 9000+ runs at an average of 37+. His Test credentials are exceptional with 123 caps and 306 ODI appearances, establishing him as India's most consistent international performer. At RCB, he serves as both captain and batting pillar, providing leadership and tactical acumen alongside his explosive batting. His ability to construct innings in pressure situations and anchor middle-order collapses makes him invaluable in tournament play. Despite reaching 36 years old, his fitness levels and hunger for runs remain undiminished, making him a crucial retention for RCB's championship aspirations. His legacy status combined with ongoing performance ensures he remains central to RCB's long-term strategy."
Rajat Patidar,RCB,BATTER,11,RHB,,5,11,0,22,Capped,"Rajat Patidar has emerged as one of India's most promising young batsmen with 5 Test caps and 11 ODI appearances despite his early career stage. In IPL, he has established himself as a reliable middle-order batsman with 22 matches, showing consistency and temperament against quality bowling. His domestic cricket record showcases an ability to play both aggressive and defensive cricket depending on match situations. At just 27 years old, Patidar represents RCB's investment in a player who can develop into a core squad member for the next 5-6 years. His left-hand batting against right-arm pace bowlers provides tactical balance in the middle-order, particularly crucial in tournament knockouts. RCB retained him as part of their transition plan from established players to homegrown talent development."
Yash Dayal,RCB,BOWLER,5,RHB,RIGHT ARM Fast,0,0,0,1,Uncapped,"Yash Dayal is an uncapped young Indian fast bowler with immense potential in the death-overs bowling department. Though he has played only 1 IPL match, his domestic first-class cricket showcases genuine pace (140+ km/h) and ability to trouble quality batsmen. At 22 years old, he fits perfectly into RCB's long-term pace bowling strategy, providing a left-arm angle which is valuable against right-handed batsmen. His retention is a calculated investment in developing homegrown fast-bowling talent rather than relying solely on overseas pacers. The uncapped status provides RCB with salary cap flexibility while securing a promising talent for future seasons. RCB sees potential in him to develop into a death-overs specialist similar to other young Indian pacers who have flourished in the IPL."
Jasprit Bumrah,MI,BOWLER,18,RHB,RIGHT ARM Fast,52,89,83,145,Capped,"Jasprit Bumrah stands as the world's premier death-overs bowler with exceptional international credentials including 46 Test caps, 89 ODI appearances, and 70 T20I matches. His 2024 T20 World Cup performance where he won Player of the Tournament award showcased his ability to deliver under extreme pressure on cricket's biggest stage. In IPL, he has played 145 matches, consistently delivering match-winning performances in crunch situations with an economy rate that rivals international standards. MI's franchise is built around Bumrah's bowling capabilities, as his presence allows aggressive batting strategies knowing death overs are secured. His leadership qualities and maturity make him an unofficial vice-captain for Mumbai Indians, influencing team culture beyond just bowling statistics. Retaining him is non-negotiable for MI's championship ambitions as his absence directly impacts team's win probability in crucial matches."
Suryakumar Yadav,MI,BATTER,16.35,RHB,,0,37,78,96,Capped,"Suryakumar Yadav was recently ranked as the world's #1 T20 international batsman, cementing his status as cricket's premier 20-over format specialist. His T20I record stands at 78 matches with consistent run-scoring at strike rates exceeding 145, complemented by 37 ODI caps showing versatility across formats. In IPL, he has aggregated over 2500+ runs in 96 matches with average strike rate above 150, making him one of the league's most dangerous middle-order batsmen. His technique against short-pitched bowling and ability to play innovative strokes in congested fielding situations sets him apart from other Indian batsmen. At age 33, despite showing age in Test cricket, his T20 skills remain world-class with reflexes and shot-making abilities undiminished. MI's dependency on Suryakumar in the middle-order means his retention is absolutely crucial for maintaining batting stability and championship credentials."
Hardik Pandya,MI,ALL-ROUNDER,16.35,RHB,RIGHT ARM Fast Medium,11,48,60,133,Capped,"Hardik Pandya is a complete all-rounder with 11 Test caps, 48 ODI appearances, 60 T20I caps, and proven captaincy experience leading Gujarat Titans to IPL title. His ability to win matches single-handedly through explosive batting and death-overs bowling makes him invaluable in T20 cricket where all-rounders command premium value. In IPL, he has played 133 matches, consistently contributing with bat and ball while demonstrating leadership qualities crucial for Mumbai Indians' franchise stability. Despite recurring fitness concerns that have disrupted his career periodically, his baseline skill level when fit remains among the best in world cricket. His role as MI captain following Rohit Sharma's transition provides continuity and leadership experience that money cannot buy in cricket. At 31 years old, retaining him is strategic investment in experienced leadership combined with match-winning all-round capabilities."
Rohit Sharma,MI,BATTER,16.3,RHB,,62,159,159,269,Capped,"Rohit Sharma is the captain of the Indian cricket team and holds the record as one of the most successful T20 international batsmen with 159 T20I caps alongside 62 Test appearances and 279 ODI matches. His IPL record is legendary with 269 matches and 6000+ runs, including multiple centuries and consistent performances as opener that have defined Mumbai Indians' dynasty. His captaincy success with MI includes multiple IPL titles and his elevation to India captaincy reflects his tactical acumen and leadership caliber. Though approaching 37 years, his fitness regimen and technical prowess against all bowling types remain exceptional, particularly against pace bowling with short-pitched tactics. His role as franchise leader transcends statistics—his presence influences team culture, younger player development, and dressing room environment positively. Retaining him is essential for MI's continuity as captain figure and batting anchor in opening position."
Tilak Varma,MI,ALL-ROUNDER,8,RHB,,0,1,4,39,Capped,"Tilak Varma represents Mumbai Indians' investment in young Indian batting talent with early international exposure (1 ODI, 4 T20I caps) at just age 22. In IPL, he has showcased immense promise with 39 matches, demonstrating ability to play long innings as anchor or accelerate in death overs depending on match context. His domestic cricket credentials highlight technical soundness against all types of bowling with particular strength against spin, crucial skill in Indian T20 conditions. Despite lacking significant international experience, his trajectory suggests potential to develop into India's next generation top-order batsman over next 5-6 years. His retention by MI signals confidence in his ability to complement Rohit Sharma and Suryakumar Yadav in the opening combinations. At his age, retaining him early locks in his services as he develops, providing financial advantage while securing long-term batting stability."
Heinrich Klaasen,SRH,BATTER,23,RHB,,5,17,24,31,Capped,"Heinrich Klaasen is South Africa's premier wicketkeeper-batsman with 5 Test caps, 17 ODI appearances, and 24 T20I matches, all demonstrating exceptional batting ability across formats. His T20 credentials are particularly strong with aggressive batting approach and ability to construct match-winning innings in crunch situations. In IPL, despite limited matches (31), his strike rate exceeds 140+ with proven ability against premium bowlers, showcasing why international franchises heavily bid for South African talent. His retention by SRH for Rs 23 crore demonstrates franchise confidence in his ability to stabilize wicketkeeper position while providing explosive batting in middle order. Though primarily wicketkeeper, his batting skills often warrant selection as pure batsman in T20 teams, adding tactical flexibility for SRH. At age 32, his international experience and T20 match-sense make him valuable acquisition for SRH's championship ambitions."
Pat Cummins,SRH,ALL-ROUNDER,18,RHB,RIGHT ARM Fast,9,26,36,56,Capped,"Pat Cummins is the captain of Australian cricket team with 9 Test caps, 26 ODI appearances, and 36 T20I matches, representing world-class fast-bowling pedigree. His captaincy of Australia across formats combined with consistent death-overs bowling makes him one of world cricket's most respected all-rounders. In IPL, he has played 56 matches showcasing ability to perform under Indian conditions despite being overseas pacer, with maturity and experience beyond statistics. His role in SRH extends beyond bowling—his captaincy background influences team strategy, field placement decisions, and dressing room leadership that defines franchise culture. Though now 32 years old and past peak pace years, his experience and intelligence in T20 cricket remain at premium level, particularly in tournament knockout stages. SRH's retention reflects strategic value of overseas captaincy experience combined with reliable all-round skills."
Abhishek Sharma,SRH,ALL-ROUNDER,14,LHB,RIGHT ARM Leg Spin,1,7,16,47,Capped,"Abhishek Sharma is a promising young Indian all-rounder with 1 Test cap, 7 ODI appearances, and 16 T20I matches, demonstrating his progress through international cricket. At just age 24, he combines aggressive left-hand batting with useful off-break bowling, providing tactical balance in T20 teams where all-rounders are premium commodities. In IPL, he has played 47 matches with growing reputation for explosive batting particularly against pace bowling, along with tidy bowling figures when called upon. His retention by SRH at Rs 14 crore reflects franchise confidence in his development trajectory as core player over next 4-5 years. Despite early career stage, his all-round skill set and age profile suggest potential to develop into India's next generation all-rounder in limited-overs cricket. SRH's strategic retention positions him as crucial investment in homegrown talent development while securing services at reasonable cost before valuations escalate."
Travis Head,SRH,BATTER,14,LHB,,17,34,35,6,Capped,"Travis Head is Australian Test batsman with 17 Test caps, 34 ODI appearances, and 35 T20I matches, with particularly strong credentials in Test cricket format. His Test average hovers near 50 with multiple centuries, establishing him as one of Australia's most reliable opening batsmen in longer format. Though limited IPL exposure (6 matches), his aggressive left-hand batting and international experience bring tactical value to SRH's middle order. At age 32, he represents overseas investment in experienced international player who can provide stability in pressure situations despite limited IPL familiarity. His Test success translates to understanding of match situations and ability to build innings under pressure, valuable qualities in T20 franchise cricket. SRH's retention reflects belief that his Test match temperament and left-hand batting provide unique balance in franchise lineup."
Nitish Kumar Reddy,SRH,ALL-ROUNDER,6,RHB,,10,3,13,53,Capped,"Nitish Kumar Reddy is an emerging Indian all-rounder with 10 Test caps, 3 ODI appearances, and 13 T20I matches, representing new generation of Indian cricketers developed through T20 exposure. At just age 21, his right-hand batting and occasional off-break bowling provide balance that modern T20 teams require in their squad composition. In IPL, he has played 53 matches demonstrating consistent performances as middle-order batsman and part-time bowler, fitting SRH's all-rounder strategy perfectly. His retention reflects SRH management confidence that he will develop into a cornerstone player over next 5-7 years, particularly given his age and learning trajectory. His inclusion in Indian teams across formats despite limited experience demonstrates selectors' belief in his long-term potential for national cricket. SRH's early retention is strategic move to secure a young talent before his valuation increases post international performances."
Ruturaj Gaikwad,CSK,BATTER,18,RHB,,17,1,0,44,Capped,"Ruturaj Gaikwad is an established Indian opening batsman with 17 Test caps (though primarily domestic player), representing CSK's faith in homegrown talent development. In IPL, he has evolved into one of league's most reliable opening batsmen with 44 matches and consistent run accumulation with strike rates suitable for anchoring innings. His Test cricket exposure, though limited in caps (17), provides confidence that he has quality to graduate into senior international batsman roles given sufficient opportunity. At age 25, he is in prime years for cricket development, showing technical improvements and maturity in shot selection particularly against pace bowling. His role as CSK's primary Indian opener provides stability to franchise's batting lineup, crucial element for consistency across season's 14 matches. CSK's retention reflects core strategy of building team around trustworthy Indian players rather than over-relying on overseas acquisitions or ever-changing squad combinations."
Ravindra Jadeja,CSK,ALL-ROUNDER,18,LHB,RIGHT ARM Off Spin,19,4,3,224,Capped,"Ravindra Jadeja holds cult status at CSK with 19 Test caps, 4 ODI appearances, 3 T20I matches, and most importantly, 224 IPL matches representing unmatched loyalty to single franchise. His all-round skills combining left-hand batting and orthodox left-arm spin bowling provide constant tactical options in T20 cricket where flexibility determines outcomes. In IPL, his consistency across 224 matches transcends statistics—his fielding athleticism, match awareness, and ability to perform in crisis situations define his value to CSK. Though now 36 years old and past peak performance years, his cricket intelligence and experience in tournament knockouts remain invaluable for franchise stability. His captaincy experience (IPL and international) combined with fielding excellence make him unofficial vice-captain influencing team culture beyond playing contributions. CSK's retention of Jadeja reflects franchise philosophy of valuing loyalty and experience, with his presence providing intangible benefits that statistics cannot capture."
Matheesha Pathirana,CSK,BOWLER,13,RHB,RIGHT ARM Fast Medium,0,0,1,19,Uncapped,"Matheesha Pathirana is an uncapped Sri Lankan fast bowler emerging as potential world-class death-overs specialist based on domestic performances and limited international exposure (1 T20I cap). At just age 19, his exceptional pace (145+ km/h) and ability to execute yorkers under pressure positions him as rare talent in cricket. In IPL, his exposure (19 matches) has been limited but showcases potential with ability to trouble quality batsmen despite inexperience in high-pressure situations. His retention by CSK is investment in developing young overseas talent similar to how franchises have nurtured Jasprit Bumrah and other young bowlers in earlier years. His uncapped status provides CSK salary cap advantage while securing services of player with genuine world-class potential over next 5-6 years. CSK's strategic retention reflects belief that his age and skill combination could deliver exceptional value during peak years of his career."
Shivam Dube,CSK,ALL-ROUNDER,12,RHB,,4,8,6,82,Capped,"Shivam Dube is an Indian all-rounder with 4 Test caps, 8 ODI appearances, 6 T20I matches, and extensive domestic first-class cricket experience showcasing consistent performances. His role as aggressive middle-order batsman with occasional right-arm medium bowling provides tactical flexibility that CSK values in their squad construction. In IPL, he has played 82 matches with growing reputation for playing explosive innings under pressure situations, particularly in powerplay and death overs. At age 28, he is approaching peak performance years with maturity to understand match situations combined with aggressive batting instincts required in modern T20 cricket. His domestic cricket records highlight ability to score heavily in first-class cricket, suggesting technical soundness beyond just T20 explosive batting capabilities. CSK's retention reflects confidence in his development as core player capable of delivering match-winning performances in tournament's crucial stages."
MS Dhoni,CSK,BATTER,4,RHB,,90,98,98,234,Capped,"MS Dhoni is living cricket legend with 90 Test caps, 98 ODI appearances, 98 T20I matches, and unmatched reputation as greatest wicketkeeper-batsman in cricket history. His captaincy record across international formats and IPL (CSK 5 titles) establishes him as arguably the most successful captain in T20 franchise history. In IPL, his 234 matches demonstrate unmatched loyalty to single franchise, with his presence defining CSK's culture and philosophy of valuing commitment over transient success. Now 44 years old, his continued performances at elite level despite age remain remarkable testament to fitness regimen and cricket intelligence honed over 25+ year career. His role extends far beyond playing—as franchise mentor and leader, his presence influences younger player development and team morale in ways that transcend statistical measurement. CSK's retention represents franchise's core identity built around Dhoni's leadership, experience, and unwavering commitment to franchise success across decades."
Axar Patel,DC,ALL-ROUNDER,16.5,LHB,RIGHT ARM Off Spin,13,32,18,142,Capped,"Axar Patel is an established Indian all-rounder with 13 Test caps, 32 ODI appearances, 18 T20I matches, demonstrating versatility across international cricket formats. His left-hand batting combined with orthodox off-break bowling provides balanced skillset that modern T20 teams require for middle-order stability and bowling flexibility. In IPL, he has played 142 matches establishing himself as one of league's most consistent all-rounders with ability to contribute with both bat and ball across varied match situations. At age 32, he remains in prime years combining international experience with tactical maturity earned through years of franchise cricket. His role at DC extends beyond playing—his experience as India team member influences dressing room standards and provides leadership perspective valuable for developing franchise. DC's retention reflects strategic value of experienced all-rounder capable of delivering reliable performances in crucial tournament stages."
Kuldeep Yadav,DC,BOWLER,13.25,RHB,LEFT ARM Slow Orthodox,10,6,1,75,Capped,"Kuldeep Yadav is India's premier mystery spinner with 10 Test caps, 6 ODI appearances, 1 T20I cap, and extensive domestic first-class cricket showcasing exceptional bowling records. His left-arm orthodox spin bowling combined with ability to deliver at crucial moments makes him invaluable asset in T20 cricket where quality spinners determine outcomes. In IPL, he has established himself as leading spinner with 75 matches and consistent ability to take wickets while maintaining economy rate below 8 runs per over. At age 28, he remains in prime years for bowler development, with potential to become India's leading spinner in international cricket given proper opportunity and consistency. His role at DC positions him as bowling anchor, crucial element for franchise's strategy of building around Indian talent rather than over-relying on overseas acquisitions. DC's retention reflects confidence that Kuldeep will develop into world-class spinner capable of delivering match-winning performances in tournament's knockout stages."
Tristan Stubbs,DC,BATTER,10,RHB,,4,4,2,8,Capped,"Tristan Stubbs is a South African batter with 4 Test caps, 4 ODI appearances, 2 T20I matches, representing emerging South African talent in international cricket. At just age 24, he has already established himself as one of South Africa's most promising young batsmen with exceptional technical prowess. In IPL, despite limited exposure (8 matches), his batting approach and ability to play quality bowling showcases why South African franchises and teams bid heavily for his services. His retention by DC reflects investment in young international talent with significant upside potential over next 5-6 years of cricket development. His South African background provides tactical diversity in DC lineup while his age ensures long-term availability for franchise building around. DC's strategic retention positions Stubbs as potential cornerstone overseas batsman as his career progresses through international cricket levels."
Abishek Porel,DC,BATTER,4,RHB,,1,1,0,7,Uncapped,"Abishek Porel is an uncapped young Indian wicketkeeper-batsman with 1 Test cap (early in career) and 1 ODI appearance, representing India's next generation behind stumps. At just age 22, he combines athletic wicketkeeping skills with promising batting credentials demonstrated in domestic cricket. In IPL, despite limited exposure (7 matches), his performances showcase ability to handle pressure situations and bat aggressively in middle-order position. His retention by DC is strategic investment in developing homegrown wicketkeeper talent to provide long-term succession planning beyond immediate requirements. His youth and uncapped status provide DC significant salary cap advantage while securing services of potential future India wicketkeeper. DC's retention reflects forward-thinking franchise philosophy of identifying young talent early and providing platform for development within structured team environment."
Rinku Singh,KKR,BATTER,13,RHB,RIGHT ARM Leg Spin,0,3,22,89,Capped,"Rinku Singh is an Indian batter-spinner with 0 Test caps, 3 ODI appearances, 22 T20I matches, establishing himself as left-hand finisher in Indian cricket team. At age 24, his batting specialization is lower middle-order aggressiveness combined with useful leg-break bowling, providing flexibility in T20 combinations. In IPL, he has played 89 matches establishing reputation as reliable lower-order batter capable of converting matches with aggressive batting in final overs. His role at KKR extends beyond batting—his occasional leg-break bowling adds bowler variety while his consistent performances in IPL demonstrate reliability franchises value. His left-hand batting against right-arm pace provides tactical balance in KKR lineup, particularly crucial against teams with primarily fast bowlers. KKR's retention reflects confidence in his continued development as core lower-order player capable of winning matches through explosive batting."
Varun Chakravarthy,KKR,ALL-ROUNDER,12,RHB,RIGHT ARM Leg Spin,5,8,34,67,Capped,"Varun Chakravarthy is KKR's captain with 5 Test caps, 8 ODI appearances, 34 T20I matches, representing world-class spinner and proven international performer. His captaincy role with KKR following appointment reflects franchise confidence in his tactical acumen and leadership qualities beyond bowling performances. His mystery spinnerology combined with variations and ability to deliver in pressure situations makes him one of world's best T20 spinners. In IPL, he has played 67 matches establishing KKR as his home franchise with consistent match-winning performances as both bowler and occasional batsman. At age 27, he is in prime years for spinner development with potential to evolve into India's leading spinner in international cricket. KKR's retention reflects strategic foundation-building around young captaincy combined with world-class bowling capability."
Sunil Narine,KKR,BOWLER,12,RHB,LEFT ARM Slow Orthodox,0,0,15,156,Capped,"Sunil Narine is Caribbean cricket legend with 15 T20I caps and extensive international T20 experience, representing one of world's best death-overs bowlers. His mystery bowling style and ability to execute yorkers under extreme pressure has terrorized batsmen across global T20 leagues. In IPL, his 156 matches with KKR demonstrate unmatched consistency as franchise's death-overs specialist with economy rates and strike rates that define world-class bowling standards. At age 36, despite aging, his bowling fundamentals remain intact with experience accumulated over 15+ year T20 career transcending physical decline. His role at KKR extends beyond statistics—his leadership in bowling group and mentoring of younger bowlers influences franchise bowling culture positively. KKR's retention reflects strategic value of experience and proven death-overs reliability in tournament's crucial stages."
